Nombre comercial,Forma Farmacéutica,Sustancia activa,Fecha de Emisión,Fecha Vencimiento,Registro,Condición venta,Clasificación de venta,Laboratorio,Tipo de Sociedad
kabigmine,POLVO,Dieta modular,06/09/2017,06/09/2022,007F2017,OTC,V,Fresenius Kabi México,S.A. de C.V.
kabigmine ox,POLVO,"Dieta Modular (Glutamina, vitaminas, antioxidantes y oligoelementos)",12/10/2018,12/10/2023,013F2018,OTC,V,Fresenius Kabi México,S.A. de C.V.
fresubin fibra,LÍQUIDO,Dieta polimérica con fibra,01/08/2016,01/08/2021,001F2016,OTC,V,Fresenius Kabi México,S.A. de C.V.
vivasse fibra,LÍQUIDO,Dieta polimérica con fibra,26/04/2017,26/04/2022,002F2017,OTC,V,Nucitec,S.A. de C.V.
supportan dkn,LÍQUIDO,Dieta polimérica con fibra hipercalórica,15/05/2017,15/05/2022,003F2017,OTC,V,Fresenius Kabi México,S.A. de C.V.
vivasse,LÍQUIDO,Dieta polimérica sin fibra,26/04/2017,26/04/2022,001F2017,OTC,V,Nucitec,S.A. de C.V.
fresubin,LÍQUIDO,Dieta polimérica sin fibra,01/08/2016,01/08/2021,004F2016,OTC,V,Fresenius Kabi México,S.A. de C.V.
